{
  "$schema": "./environment.schema.json",
  "name": "production",
  "git": {
    "repository": "vicdenz/study-up",
    "branch": "main",
    "requiredChecks": [
      "static-analysis",
      "unit",
      "edge-functions",
      "browser-e2e",
      "performance",
      "database",
      "integration-e2e"
    ],
    "directPushesAllowed": false,
    "forcePushesAllowed": false,
    "deletionAllowed": false
  },
  "github": {
    "branchPolicy": "protected",
    "requirePullRequest": true,
    "requiredPullRequestApprovals": 0,
    "dismissStaleReviews": false,
    "requireConversationResolution": false,
    "requireUpToDateBranch": true
  },
  "vercel": {
    "project": "study-up",
    "target": "production",
    "productionBranch": "main"
  },
  "supabase": {
    "projectRef": "hzkwaecgggkjikwlvghi",
    "branch": "main"
  }
}
